No.     Time           Source                Destination           Protocol Length Info
      1 0.000000       host                  1.29.0                USB      36     GET DESCRIPTOR Request DEVICE

Frame 1: 36 bytes on wire (288 bits), 36 bytes captured (288 bits) on interface \\.\USBPcap1, id 0
    Section number: 1
    Interface id: 0 (\\.\USBPcap1)
        Interface name: \\.\USBPcap1
        Interface description: USBPcap1
    Encapsulation type: USB packets with USBPcap header (152)
    Arrival Time: Sep 24, 2025 13:33:54.558598000 CEST
    UTC Arrival Time: Sep 24, 2025 11:33:54.558598000 UTC
    Epoch Arrival Time: 1758713634.558598000
    [Time shift for this packet: 0.000000000 seconds]
    [Time delta from previous captured frame: 0.000000000 seconds]
    [Time delta from previous displayed frame: 0.000000000 seconds]
    [Time since reference or first frame: 0.000000000 seconds]
    Frame Number: 1
    Frame Length: 36 bytes (288 bits)
    Capture Length: 36 bytes (288 bits)
    [Frame is marked: False]
    [Frame is ignored: False]
    [Protocols in frame: usb]
USB URB
    [Source: host]
    [Destination: 1.29.0]
    USBPcap pseudoheader length: 28
    IRP ID: 0x0000000000000000
    IRP USBD_STATUS: USBD_STATUS_SUCCESS (0x00000000)
    URB Function: URB_FUNCTION_GET_DESCRIPTOR_FROM_DEVICE (0x000b)
    IRP information: 0x00, Direction: FDO -> PDO
        0000 000. = Reserved: 0x00
        .... ...0 = Direction: FDO -> PDO (0x0)
    URB bus id: 1
    Device address: 29
    Endpoint: 0x80, Direction: IN
        1... .... = Direction: IN (1)
        .... 0000 = Endpoint number: 0
    URB transfer type: URB_CONTROL (0x02)
    Packet Data Length: 8
    [Response in: 2]
    Control transfer stage: Setup (0)
Setup Data
    bmRequestType: 0x80
        1... .... = Direction: Device-to-host
        .00. .... = Type: Standard (0x0)
        ...0 0000 = Recipient: Device (0x00)
    bRequest: GET DESCRIPTOR (6)
    Descriptor Index: 0x00
    bDescriptorType: DEVICE (0x01)
    Language Id: no language specified (0x0000)
    wLength: 18

No.     Time           Source                Destination           Protocol Length Info
      2 0.000000       1.29.0                host                  USB      46     GET DESCRIPTOR Response DEVICE

Frame 2: 46 bytes on wire (368 bits), 46 bytes captured (368 bits) on interface \\.\USBPcap1, id 0
    Section number: 1
    Interface id: 0 (\\.\USBPcap1)
        Interface name: \\.\USBPcap1
        Interface description: USBPcap1
    Encapsulation type: USB packets with USBPcap header (152)
    Arrival Time: Sep 24, 2025 13:33:54.558598000 CEST
    UTC Arrival Time: Sep 24, 2025 11:33:54.558598000 UTC
    Epoch Arrival Time: 1758713634.558598000
    [Time shift for this packet: 0.000000000 seconds]
    [Time delta from previous captured frame: 0.000000000 seconds]
    [Time delta from previous displayed frame: 0.000000000 seconds]
    [Time since reference or first frame: 0.000000000 seconds]
    Frame Number: 2
    Frame Length: 46 bytes (368 bits)
    Capture Length: 46 bytes (368 bits)
    [Frame is marked: False]
    [Frame is ignored: False]
    [Protocols in frame: usb]
USB URB
    [Source: 1.29.0]
    [Destination: host]
    USBPcap pseudoheader length: 28
    IRP ID: 0x0000000000000000
    IRP USBD_STATUS: USBD_STATUS_SUCCESS (0x00000000)
    URB Function: URB_FUNCTION_CONTROL_TRANSFER (0x0008)
    IRP information: 0x01, Direction: PDO -> FDO
        0000 000. = Reserved: 0x00
        .... ...1 = Direction: PDO -> FDO (0x1)
    URB bus id: 1
    Device address: 29
    Endpoint: 0x80, Direction: IN
        1... .... = Direction: IN (1)
        .... 0000 = Endpoint number: 0
    URB transfer type: URB_CONTROL (0x02)
    Packet Data Length: 18
    [Request in: 1]
    [Time from request: 0.000000000 seconds]
    Control transfer stage: Complete (3)
DEVICE DESCRIPTOR
    bLength: 18
    bDescriptorType: 0x01 (DEVICE)
    bcdUSB: 0x0200
    bDeviceClass: Device (0x00)
    bDeviceSubClass: 0
    bDeviceProtocol: 0 (Use class code info from Interface Descriptors)
    bMaxPacketSize0: 64
    idVendor: Unknown (0x0fb4)
    idProduct: Unknown (0x0201)
    bcdDevice: 0x0001
    iManufacturer: 1
    iProduct: 2
    iSerialNumber: 3
    bNumConfigurations: 1

No.     Time           Source                Destination           Protocol Length Info
      3 0.000000       host                  1.29.0                USB      36     GET DESCRIPTOR Request CONFIGURATION

Frame 3: 36 bytes on wire (288 bits), 36 bytes captured (288 bits) on interface \\.\USBPcap1, id 0
    Section number: 1
    Interface id: 0 (\\.\USBPcap1)
        Interface name: \\.\USBPcap1
        Interface description: USBPcap1
    Encapsulation type: USB packets with USBPcap header (152)
    Arrival Time: Sep 24, 2025 13:33:54.558598000 CEST
    UTC Arrival Time: Sep 24, 2025 11:33:54.558598000 UTC
    Epoch Arrival Time: 1758713634.558598000
    [Time shift for this packet: 0.000000000 seconds]
    [Time delta from previous captured frame: 0.000000000 seconds]
    [Time delta from previous displayed frame: 0.000000000 seconds]
    [Time since reference or first frame: 0.000000000 seconds]
    Frame Number: 3
    Frame Length: 36 bytes (288 bits)
    Capture Length: 36 bytes (288 bits)
    [Frame is marked: False]
    [Frame is ignored: False]
    [Protocols in frame: usb]
USB URB
    [Source: host]
    [Destination: 1.29.0]
    USBPcap pseudoheader length: 28
    IRP ID: 0x0000000000000000
    IRP USBD_STATUS: USBD_STATUS_SUCCESS (0x00000000)
    URB Function: URB_FUNCTION_GET_DESCRIPTOR_FROM_DEVICE (0x000b)
    IRP information: 0x00, Direction: FDO -> PDO
        0000 000. = Reserved: 0x00
        .... ...0 = Direction: FDO -> PDO (0x0)
    URB bus id: 1
    Device address: 29
    Endpoint: 0x80, Direction: IN
        1... .... = Direction: IN (1)
        .... 0000 = Endpoint number: 0
    URB transfer type: URB_CONTROL (0x02)
    Packet Data Length: 8
    [Response in: 4]
    Control transfer stage: Setup (0)
Setup Data
    bmRequestType: 0x80
        1... .... = Direction: Device-to-host
        .00. .... = Type: Standard (0x0)
        ...0 0000 = Recipient: Device (0x00)
    bRequest: GET DESCRIPTOR (6)
    Descriptor Index: 0x00
    bDescriptorType: CONFIGURATION (0x02)
    Language Id: no language specified (0x0000)
    wLength: 60

No.     Time           Source                Destination           Protocol Length Info
      4 0.000000       1.29.0                host                  USB      88     GET DESCRIPTOR Response CONFIGURATION

Frame 4: 88 bytes on wire (704 bits), 88 bytes captured (704 bits) on interface \\.\USBPcap1, id 0
    Section number: 1
    Interface id: 0 (\\.\USBPcap1)
        Interface name: \\.\USBPcap1
        Interface description: USBPcap1
    Encapsulation type: USB packets with USBPcap header (152)
    Arrival Time: Sep 24, 2025 13:33:54.558598000 CEST
    UTC Arrival Time: Sep 24, 2025 11:33:54.558598000 UTC
    Epoch Arrival Time: 1758713634.558598000
    [Time shift for this packet: 0.000000000 seconds]
    [Time delta from previous captured frame: 0.000000000 seconds]
    [Time delta from previous displayed frame: 0.000000000 seconds]
    [Time since reference or first frame: 0.000000000 seconds]
    Frame Number: 4
    Frame Length: 88 bytes (704 bits)
    Capture Length: 88 bytes (704 bits)
    [Frame is marked: False]
    [Frame is ignored: False]
    [Protocols in frame: usb]
USB URB
    [Source: 1.29.0]
    [Destination: host]
    USBPcap pseudoheader length: 28
    IRP ID: 0x0000000000000000
    IRP USBD_STATUS: USBD_STATUS_SUCCESS (0x00000000)
    URB Function: URB_FUNCTION_CONTROL_TRANSFER (0x0008)
    IRP information: 0x01, Direction: PDO -> FDO
        0000 000. = Reserved: 0x00
        .... ...1 = Direction: PDO -> FDO (0x1)
    URB bus id: 1
    Device address: 29
    Endpoint: 0x80, Direction: IN
        1... .... = Direction: IN (1)
        .... 0000 = Endpoint number: 0
    URB transfer type: URB_CONTROL (0x02)
    Packet Data Length: 60
    [Request in: 3]
    [Time from request: 0.000000000 seconds]
    Control transfer stage: Complete (3)
CONFIGURATION DESCRIPTOR
    bLength: 9
    bDescriptorType: 0x02 (CONFIGURATION)
    wTotalLength: 60
    bNumInterfaces: 1
    bConfigurationValue: 1
    iConfiguration: 0
    Configuration bmAttributes: 0xc0  SELF-POWERED  NO REMOTE-WAKEUP
        1... .... = Must be 1: Must be 1 for USB 1.1 and higher
        .1.. .... = Self-Powered: This device is SELF-POWERED
        ..0. .... = Remote Wakeup: This device does NOT support remote wakeup
    bMaxPower: 0  (0mA)
INTERFACE DESCRIPTOR (0.0): class Vendor Specific
    bLength: 9
    bDescriptorType: 0x04 (INTERFACE)
    bInterfaceNumber: 0
    bAlternateSetting: 0
    bNumEndpoints: 6
    bInterfaceClass: Vendor Specific (0xff)
    bInterfaceSubClass: 0x00
    bInterfaceProtocol: 0x00
    iInterface: 0
ENDPOINT DESCRIPTOR
    bLength: 7
    bDescriptorType: 0x05 (ENDPOINT)
    bEndpointAddress: 0x81  IN  Endpoint:1
        1... .... = Direction: IN Endpoint
        .... 0001 = Endpoint Number: 0x1
    bmAttributes: 0x02
        .... ..10 = Transfertype: Bulk-Transfer (0x2)
    wMaxPacketSize: 64
        .... .000 0100 0000 = Maximum Packet Size: 64
    bInterval: 0
ENDPOINT DESCRIPTOR
    bLength: 7
    bDescriptorType: 0x05 (ENDPOINT)
    bEndpointAddress: 0x02  OUT  Endpoint:2
        0... .... = Direction: OUT Endpoint
        .... 0010 = Endpoint Number: 0x2
    bmAttributes: 0x02
        .... ..10 = Transfertype: Bulk-Transfer (0x2)
    wMaxPacketSize: 64
        .... .000 0100 0000 = Maximum Packet Size: 64
    bInterval: 0
ENDPOINT DESCRIPTOR
    bLength: 7
    bDescriptorType: 0x05 (ENDPOINT)
    bEndpointAddress: 0x83  IN  Endpoint:3
        1... .... = Direction: IN Endpoint
        .... 0011 = Endpoint Number: 0x3
    bmAttributes: 0x02
        .... ..10 = Transfertype: Bulk-Transfer (0x2)
    wMaxPacketSize: 64
        .... .000 0100 0000 = Maximum Packet Size: 64
    bInterval: 0
ENDPOINT DESCRIPTOR
    bLength: 7
    bDescriptorType: 0x05 (ENDPOINT)
    bEndpointAddress: 0x04  OUT  Endpoint:4
        0... .... = Direction: OUT Endpoint
        .... 0100 = Endpoint Number: 0x4
    bmAttributes: 0x02
        .... ..10 = Transfertype: Bulk-Transfer (0x2)
    wMaxPacketSize: 64
        .... .000 0100 0000 = Maximum Packet Size: 64
    bInterval: 0
ENDPOINT DESCRIPTOR
    bLength: 7
    bDescriptorType: 0x05 (ENDPOINT)
    bEndpointAddress: 0x85  IN  Endpoint:5
        1... .... = Direction: IN Endpoint
        .... 0101 = Endpoint Number: 0x5
    bmAttributes: 0x02
        .... ..10 = Transfertype: Bulk-Transfer (0x2)
    wMaxPacketSize: 512
        .... .010 0000 0000 = Maximum Packet Size: 512
    bInterval: 0
ENDPOINT DESCRIPTOR
    bLength: 7
    bDescriptorType: 0x05 (ENDPOINT)
    bEndpointAddress: 0x06  OUT  Endpoint:6
        0... .... = Direction: OUT Endpoint
        .... 0110 = Endpoint Number: 0x6
    bmAttributes: 0x02
        .... ..10 = Transfertype: Bulk-Transfer (0x2)
    wMaxPacketSize: 512
        .... .010 0000 0000 = Maximum Packet Size: 512
    bInterval: 0

No.     Time           Source                Destination           Protocol Length Info
      5 0.000000       host                  1.29.0                USB      36     SET CONFIGURATION Request

Frame 5: 36 bytes on wire (288 bits), 36 bytes captured (288 bits) on interface \\.\USBPcap1, id 0
    Section number: 1
    Interface id: 0 (\\.\USBPcap1)
        Interface name: \\.\USBPcap1
        Interface description: USBPcap1
    Encapsulation type: USB packets with USBPcap header (152)
    Arrival Time: Sep 24, 2025 13:33:54.558598000 CEST
    UTC Arrival Time: Sep 24, 2025 11:33:54.558598000 UTC
    Epoch Arrival Time: 1758713634.558598000
    [Time shift for this packet: 0.000000000 seconds]
    [Time delta from previous captured frame: 0.000000000 seconds]
    [Time delta from previous displayed frame: 0.000000000 seconds]
    [Time since reference or first frame: 0.000000000 seconds]
    Frame Number: 5
    Frame Length: 36 bytes (288 bits)
    Capture Length: 36 bytes (288 bits)
    [Frame is marked: False]
    [Frame is ignored: False]
    [Protocols in frame: usb]
USB URB
    [Source: host]
    [Destination: 1.29.0]
    USBPcap pseudoheader length: 28
    IRP ID: 0x0000000000000000
    IRP USBD_STATUS: USBD_STATUS_SUCCESS (0x00000000)
    URB Function: URB_FUNCTION_SELECT_CONFIGURATION (0x0000)
    IRP information: 0x00, Direction: FDO -> PDO
        0000 000. = Reserved: 0x00
        .... ...0 = Direction: FDO -> PDO (0x0)
    URB bus id: 1
    Device address: 29
    Endpoint: 0x00, Direction: OUT
        0... .... = Direction: OUT (0)
        .... 0000 = Endpoint number: 0
    URB transfer type: URB_CONTROL (0x02)
    Packet Data Length: 8
    [Response in: 6]
    Control transfer stage: Setup (0)
Setup Data
    bmRequestType: 0x00
        0... .... = Direction: Host-to-device
        .00. .... = Type: Standard (0x0)
        ...0 0000 = Recipient: Device (0x00)
    bRequest: SET CONFIGURATION (9)
    bConfigurationValue: 1
    wIndex: 0 (0x0000)
    wLength: 0

No.     Time           Source                Destination           Protocol Length Info
      6 0.000000       1.29.0                host                  USB      28     SET CONFIGURATION Response

Frame 6: 28 bytes on wire (224 bits), 28 bytes captured (224 bits) on interface \\.\USBPcap1, id 0
    Section number: 1
    Interface id: 0 (\\.\USBPcap1)
        Interface name: \\.\USBPcap1
        Interface description: USBPcap1
    Encapsulation type: USB packets with USBPcap header (152)
    Arrival Time: Sep 24, 2025 13:33:54.558598000 CEST
    UTC Arrival Time: Sep 24, 2025 11:33:54.558598000 UTC
    Epoch Arrival Time: 1758713634.558598000
    [Time shift for this packet: 0.000000000 seconds]
    [Time delta from previous captured frame: 0.000000000 seconds]
    [Time delta from previous displayed frame: 0.000000000 seconds]
    [Time since reference or first frame: 0.000000000 seconds]
    Frame Number: 6
    Frame Length: 28 bytes (224 bits)
    Capture Length: 28 bytes (224 bits)
    [Frame is marked: False]
    [Frame is ignored: False]
    [Protocols in frame: usb]
USB URB
    [Source: 1.29.0]
    [Destination: host]
    USBPcap pseudoheader length: 28
    IRP ID: 0x0000000000000000
    IRP USBD_STATUS: USBD_STATUS_SUCCESS (0x00000000)
    URB Function: URB_FUNCTION_SELECT_CONFIGURATION (0x0000)
    IRP information: 0x01, Direction: PDO -> FDO
        0000 000. = Reserved: 0x00
        .... ...1 = Direction: PDO -> FDO (0x1)
    URB bus id: 1
    Device address: 29
    Endpoint: 0x00, Direction: OUT
        0... .... = Direction: OUT (0)
        .... 0000 = Endpoint number: 0
    URB transfer type: URB_CONTROL (0x02)
    Packet Data Length: 0
    [Request in: 5]
    [Time from request: 0.000000000 seconds]
    Control transfer stage: Complete (3)

No.     Time           Source                Destination           Protocol Length Info
      7 15.578965      host                  1.29.4                USB      91     URB_BULK out

Frame 7: 91 bytes on wire (728 bits), 91 bytes captured (728 bits) on interface \\.\USBPcap1, id 0
    Section number: 1
    Interface id: 0 (\\.\USBPcap1)
        Interface name: \\.\USBPcap1
        Interface description: USBPcap1
    Encapsulation type: USB packets with USBPcap header (152)
    Arrival Time: Sep 24, 2025 13:34:10.137563000 CEST
    UTC Arrival Time: Sep 24, 2025 11:34:10.137563000 UTC
    Epoch Arrival Time: 1758713650.137563000
    [Time shift for this packet: 0.000000000 seconds]
    [Time delta from previous captured frame: 15.578965000 seconds]
    [Time delta from previous displayed frame: 15.578965000 seconds]
    [Time since reference or first frame: 15.578965000 seconds]
    Frame Number: 7
    Frame Length: 91 bytes (728 bits)
    Capture Length: 91 bytes (728 bits)
    [Frame is marked: False]
    [Frame is ignored: False]
    [Protocols in frame: usb]
USB URB
    [Source: host]
    [Destination: 1.29.4]
    USBPcap pseudoheader length: 27
    IRP ID: 0xffffa082c5fce9a0
    IRP USBD_STATUS: USBD_STATUS_SUCCESS (0x00000000)
    URB Function: URB_FUNCTION_BULK_OR_INTERRUPT_TRANSFER (0x0009)
    IRP information: 0x00, Direction: FDO -> PDO
        0000 000. = Reserved: 0x00
        .... ...0 = Direction: FDO -> PDO (0x0)
    URB bus id: 1
    Device address: 29
    Endpoint: 0x04, Direction: OUT
        0... .... = Direction: OUT (0)
        .... 0100 = Endpoint number: 4
    URB transfer type: URB_BULK (0x03)
    Packet Data Length: 64
    [Response in: 8]
    [bInterfaceClass: Vendor Specific (0xff)]
Leftover Capture Data: 0d000000000000000000000000000000000000000000000000000000000000000000000000000000000000000000000000000000000000000000000000000000

No.     Time           Source                Destination           Protocol Length Info
      8 15.579055      1.29.4                host                  USB      27     URB_BULK out

Frame 8: 27 bytes on wire (216 bits), 27 bytes captured (216 bits) on interface \\.\USBPcap1, id 0
    Section number: 1
    Interface id: 0 (\\.\USBPcap1)
        Interface name: \\.\USBPcap1
        Interface description: USBPcap1
    Encapsulation type: USB packets with USBPcap header (152)
    Arrival Time: Sep 24, 2025 13:34:10.137653000 CEST
    UTC Arrival Time: Sep 24, 2025 11:34:10.137653000 UTC
    Epoch Arrival Time: 1758713650.137653000
    [Time shift for this packet: 0.000000000 seconds]
    [Time delta from previous captured frame: 0.000090000 seconds]
    [Time delta from previous displayed frame: 0.000090000 seconds]
    [Time since reference or first frame: 15.579055000 seconds]
    Frame Number: 8
    Frame Length: 27 bytes (216 bits)
    Capture Length: 27 bytes (216 bits)
    [Frame is marked: False]
    [Frame is ignored: False]
    [Protocols in frame: usb]
USB URB
    [Source: 1.29.4]
    [Destination: host]
    USBPcap pseudoheader length: 27
    IRP ID: 0xffffa082c5fce9a0
    IRP USBD_STATUS: USBD_STATUS_SUCCESS (0x00000000)
    URB Function: URB_FUNCTION_BULK_OR_INTERRUPT_TRANSFER (0x0009)
    IRP information: 0x01, Direction: PDO -> FDO
        0000 000. = Reserved: 0x00
        .... ...1 = Direction: PDO -> FDO (0x1)
    URB bus id: 1
    Device address: 29
    Endpoint: 0x04, Direction: OUT
        0... .... = Direction: OUT (0)
        .... 0100 = Endpoint number: 4
    URB transfer type: URB_BULK (0x03)
    Packet Data Length: 0
    [Request in: 7]
    [Time from request: 0.000090000 seconds]
    [bInterfaceClass: Vendor Specific (0xff)]

No.     Time           Source                Destination           Protocol Length Info
      9 15.579104      host                  1.29.3                USB      27     URB_BULK in

Frame 9: 27 bytes on wire (216 bits), 27 bytes captured (216 bits) on interface \\.\USBPcap1, id 0
    Section number: 1
    Interface id: 0 (\\.\USBPcap1)
        Interface name: \\.\USBPcap1
        Interface description: USBPcap1
    Encapsulation type: USB packets with USBPcap header (152)
    Arrival Time: Sep 24, 2025 13:34:10.137702000 CEST
    UTC Arrival Time: Sep 24, 2025 11:34:10.137702000 UTC
    Epoch Arrival Time: 1758713650.137702000
    [Time shift for this packet: 0.000000000 seconds]
    [Time delta from previous captured frame: 0.000049000 seconds]
    [Time delta from previous displayed frame: 0.000049000 seconds]
    [Time since reference or first frame: 15.579104000 seconds]
    Frame Number: 9
    Frame Length: 27 bytes (216 bits)
    Capture Length: 27 bytes (216 bits)
    [Frame is marked: False]
    [Frame is ignored: False]
    [Protocols in frame: usb]
USB URB
    [Source: host]
    [Destination: 1.29.3]
    USBPcap pseudoheader length: 27
    IRP ID: 0xffffa082c51dd9a0
    IRP USBD_STATUS: USBD_STATUS_SUCCESS (0x00000000)
    URB Function: URB_FUNCTION_BULK_OR_INTERRUPT_TRANSFER (0x0009)
    IRP information: 0x00, Direction: FDO -> PDO
        0000 000. = Reserved: 0x00
        .... ...0 = Direction: FDO -> PDO (0x0)
    URB bus id: 1
    Device address: 29
    Endpoint: 0x83, Direction: IN
        1... .... = Direction: IN (1)
        .... 0011 = Endpoint number: 3
    URB transfer type: URB_BULK (0x03)
    Packet Data Length: 0
    [Response in: 10]
    [bInterfaceClass: Vendor Specific (0xff)]

No.     Time           Source                Destination           Protocol Length Info
     10 15.579152      1.29.3                host                  USB      91     URB_BULK in

Frame 10: 91 bytes on wire (728 bits), 91 bytes captured (728 bits) on interface \\.\USBPcap1, id 0
    Section number: 1
    Interface id: 0 (\\.\USBPcap1)
        Interface name: \\.\USBPcap1
        Interface description: USBPcap1
    Encapsulation type: USB packets with USBPcap header (152)
    Arrival Time: Sep 24, 2025 13:34:10.137750000 CEST
    UTC Arrival Time: Sep 24, 2025 11:34:10.137750000 UTC
    Epoch Arrival Time: 1758713650.137750000
    [Time shift for this packet: 0.000000000 seconds]
    [Time delta from previous captured frame: 0.000048000 seconds]
    [Time delta from previous displayed frame: 0.000048000 seconds]
    [Time since reference or first frame: 15.579152000 seconds]
    Frame Number: 10
    Frame Length: 91 bytes (728 bits)
    Capture Length: 91 bytes (728 bits)
    [Frame is marked: False]
    [Frame is ignored: False]
    [Protocols in frame: usb]
USB URB
    [Source: 1.29.3]
    [Destination: host]
    USBPcap pseudoheader length: 27
    IRP ID: 0xffffa082c51dd9a0
    IRP USBD_STATUS: USBD_STATUS_SUCCESS (0x00000000)
    URB Function: URB_FUNCTION_BULK_OR_INTERRUPT_TRANSFER (0x0009)
    IRP information: 0x01, Direction: PDO -> FDO
        0000 000. = Reserved: 0x00
        .... ...1 = Direction: PDO -> FDO (0x1)
    URB bus id: 1
    Device address: 29
    Endpoint: 0x83, Direction: IN
        1... .... = Direction: IN (1)
        .... 0011 = Endpoint number: 3
    URB transfer type: URB_BULK (0x03)
    Packet Data Length: 64
    [Request in: 9]
    [Time from request: 0.000048000 seconds]
    [bInterfaceClass: Vendor Specific (0xff)]
Leftover Capture Data: 0d00000407ff0001000000000000000000000000000000000018a2a40000000000000000000000000018a2a40000000000001f88000000000000000000000000

No.     Time           Source                Destination           Protocol Length Info
     11 15.579264      host                  1.29.4                USB      91     URB_BULK out

Frame 11: 91 bytes on wire (728 bits), 91 bytes captured (728 bits) on interface \\.\USBPcap1, id 0
    Section number: 1
    Interface id: 0 (\\.\USBPcap1)
        Interface name: \\.\USBPcap1
        Interface description: USBPcap1
    Encapsulation type: USB packets with USBPcap header (152)
    Arrival Time: Sep 24, 2025 13:34:10.137862000 CEST
    UTC Arrival Time: Sep 24, 2025 11:34:10.137862000 UTC
    Epoch Arrival Time: 1758713650.137862000
    [Time shift for this packet: 0.000000000 seconds]
    [Time delta from previous captured frame: 0.000112000 seconds]
    [Time delta from previous displayed frame: 0.000112000 seconds]
    [Time since reference or first frame: 15.579264000 seconds]
    Frame Number: 11
    Frame Length: 91 bytes (728 bits)
    Capture Length: 91 bytes (728 bits)
    [Frame is marked: False]
    [Frame is ignored: False]
    [Protocols in frame: usb]
USB URB
    [Source: host]
    [Destination: 1.29.4]
    USBPcap pseudoheader length: 27
    IRP ID: 0xffffa082cde429b0
    IRP USBD_STATUS: USBD_STATUS_SUCCESS (0x00000000)
    URB Function: URB_FUNCTION_BULK_OR_INTERRUPT_TRANSFER (0x0009)
    IRP information: 0x00, Direction: FDO -> PDO
        0000 000. = Reserved: 0x00
        .... ...0 = Direction: FDO -> PDO (0x0)
    URB bus id: 1
    Device address: 29
    Endpoint: 0x04, Direction: OUT
        0... .... = Direction: OUT (0)
        .... 0100 = Endpoint number: 4
    URB transfer type: URB_BULK (0x03)
    Packet Data Length: 64
    [Response in: 12]
    [bInterfaceClass: Vendor Specific (0xff)]
Leftover Capture Data: 0801001001000000012a000000000000000000000000000000000000000000000000000000000000000000000000000000000000000000000000000000000000

No.     Time           Source                Destination           Protocol Length Info
     12 15.579314      1.29.4                host                  USB      27     URB_BULK out

Frame 12: 27 bytes on wire (216 bits), 27 bytes captured (216 bits) on interface \\.\USBPcap1, id 0
    Section number: 1
    Interface id: 0 (\\.\USBPcap1)
        Interface name: \\.\USBPcap1
        Interface description: USBPcap1
    Encapsulation type: USB packets with USBPcap header (152)
    Arrival Time: Sep 24, 2025 13:34:10.137912000 CEST
    UTC Arrival Time: Sep 24, 2025 11:34:10.137912000 UTC
    Epoch Arrival Time: 1758713650.137912000
    [Time shift for this packet: 0.000000000 seconds]
    [Time delta from previous captured frame: 0.000050000 seconds]
    [Time delta from previous displayed frame: 0.000050000 seconds]
    [Time since reference or first frame: 15.579314000 seconds]
    Frame Number: 12
    Frame Length: 27 bytes (216 bits)
    Capture Length: 27 bytes (216 bits)
    [Frame is marked: False]
    [Frame is ignored: False]
    [Protocols in frame: usb]
USB URB
    [Source: 1.29.4]
    [Destination: host]
    USBPcap pseudoheader length: 27
    IRP ID: 0xffffa082cde429b0
    IRP USBD_STATUS: USBD_STATUS_SUCCESS (0x00000000)
    URB Function: URB_FUNCTION_BULK_OR_INTERRUPT_TRANSFER (0x0009)
    IRP information: 0x01, Direction: PDO -> FDO
        0000 000. = Reserved: 0x00
        .... ...1 = Direction: PDO -> FDO (0x1)
    URB bus id: 1
    Device address: 29
    Endpoint: 0x04, Direction: OUT
        0... .... = Direction: OUT (0)
        .... 0100 = Endpoint number: 4
    URB transfer type: URB_BULK (0x03)
    Packet Data Length: 0
    [Request in: 11]
    [Time from request: 0.000050000 seconds]
    [bInterfaceClass: Vendor Specific (0xff)]

No.     Time           Source                Destination           Protocol Length Info
     13 15.579362      host                  1.29.3                USB      27     URB_BULK in

Frame 13: 27 bytes on wire (216 bits), 27 bytes captured (216 bits) on interface \\.\USBPcap1, id 0
    Section number: 1
    Interface id: 0 (\\.\USBPcap1)
        Interface name: \\.\USBPcap1
        Interface description: USBPcap1
    Encapsulation type: USB packets with USBPcap header (152)
    Arrival Time: Sep 24, 2025 13:34:10.137960000 CEST
    UTC Arrival Time: Sep 24, 2025 11:34:10.137960000 UTC
    Epoch Arrival Time: 1758713650.137960000
    [Time shift for this packet: 0.000000000 seconds]
    [Time delta from previous captured frame: 0.000048000 seconds]
    [Time delta from previous displayed frame: 0.000048000 seconds]
    [Time since reference or first frame: 15.579362000 seconds]
    Frame Number: 13
    Frame Length: 27 bytes (216 bits)
    Capture Length: 27 bytes (216 bits)
    [Frame is marked: False]
    [Frame is ignored: False]
    [Protocols in frame: usb]
USB URB
    [Source: host]
    [Destination: 1.29.3]
    USBPcap pseudoheader length: 27
    IRP ID: 0xffffa082cd8db280
    IRP USBD_STATUS: USBD_STATUS_SUCCESS (0x00000000)
    URB Function: URB_FUNCTION_BULK_OR_INTERRUPT_TRANSFER (0x0009)
    IRP information: 0x00, Direction: FDO -> PDO
        0000 000. = Reserved: 0x00
        .... ...0 = Direction: FDO -> PDO (0x0)
    URB bus id: 1
    Device address: 29
    Endpoint: 0x83, Direction: IN
        1... .... = Direction: IN (1)
        .... 0011 = Endpoint number: 3
    URB transfer type: URB_BULK (0x03)
    Packet Data Length: 0
    [Response in: 14]
    [bInterfaceClass: Vendor Specific (0xff)]

No.     Time           Source                Destination           Protocol Length Info
     14 15.579797      1.29.3                host                  USB      91     URB_BULK in

Frame 14: 91 bytes on wire (728 bits), 91 bytes captured (728 bits) on interface \\.\USBPcap1, id 0
    Section number: 1
    Interface id: 0 (\\.\USBPcap1)
        Interface name: \\.\USBPcap1
        Interface description: USBPcap1
    Encapsulation type: USB packets with USBPcap header (152)
    Arrival Time: Sep 24, 2025 13:34:10.138395000 CEST
    UTC Arrival Time: Sep 24, 2025 11:34:10.138395000 UTC
    Epoch Arrival Time: 1758713650.138395000
    [Time shift for this packet: 0.000000000 seconds]
    [Time delta from previous captured frame: 0.000435000 seconds]
    [Time delta from previous displayed frame: 0.000435000 seconds]
    [Time since reference or first frame: 15.579797000 seconds]
    Frame Number: 14
    Frame Length: 91 bytes (728 bits)
    Capture Length: 91 bytes (728 bits)
    [Frame is marked: False]
    [Frame is ignored: False]
    [Protocols in frame: usb]
USB URB
    [Source: 1.29.3]
    [Destination: host]
    USBPcap pseudoheader length: 27
    IRP ID: 0xffffa082cd8db280
    IRP USBD_STATUS: USBD_STATUS_SUCCESS (0x00000000)
    URB Function: URB_FUNCTION_BULK_OR_INTERRUPT_TRANSFER (0x0009)
    IRP information: 0x01, Direction: PDO -> FDO
        0000 000. = Reserved: 0x00
        .... ...1 = Direction: PDO -> FDO (0x1)
    URB bus id: 1
    Device address: 29
    Endpoint: 0x83, Direction: IN
        1... .... = Direction: IN (1)
        .... 0011 = Endpoint number: 3
    URB transfer type: URB_BULK (0x03)
    Packet Data Length: 64
    [Request in: 13]
    [Time from request: 0.000435000 seconds]
    [bInterfaceClass: Vendor Specific (0xff)]
Leftover Capture Data: 0901001001004000012a00000000000000000000000000000018a2a40000000000000000000000000018a2a40000000000001f88000000000000000000000000

No.     Time           Source                Destination           Protocol Length Info
     15 15.579846      host                  1.29.4                USB      91     URB_BULK out

Frame 15: 91 bytes on wire (728 bits), 91 bytes captured (728 bits) on interface \\.\USBPcap1, id 0
    Section number: 1
    Interface id: 0 (\\.\USBPcap1)
        Interface name: \\.\USBPcap1
        Interface description: USBPcap1
    Encapsulation type: USB packets with USBPcap header (152)
    Arrival Time: Sep 24, 2025 13:34:10.138444000 CEST
    UTC Arrival Time: Sep 24, 2025 11:34:10.138444000 UTC
    Epoch Arrival Time: 1758713650.138444000
    [Time shift for this packet: 0.000000000 seconds]
    [Time delta from previous captured frame: 0.000049000 seconds]
    [Time delta from previous displayed frame: 0.000049000 seconds]
    [Time since reference or first frame: 15.579846000 seconds]
    Frame Number: 15
    Frame Length: 91 bytes (728 bits)
    Capture Length: 91 bytes (728 bits)
    [Frame is marked: False]
    [Frame is ignored: False]
    [Protocols in frame: usb]
USB URB
    [Source: host]
    [Destination: 1.29.4]
    USBPcap pseudoheader length: 27
    IRP ID: 0xffffa082c9cd5980
    IRP USBD_STATUS: USBD_STATUS_SUCCESS (0x00000000)
    URB Function: URB_FUNCTION_BULK_OR_INTERRUPT_TRANSFER (0x0009)
    IRP information: 0x00, Direction: FDO -> PDO
        0000 000. = Reserved: 0x00
        .... ...0 = Direction: FDO -> PDO (0x0)
    URB bus id: 1
    Device address: 29
    Endpoint: 0x04, Direction: OUT
        0... .... = Direction: OUT (0)
        .... 0100 = Endpoint number: 4
    URB transfer type: URB_BULK (0x03)
    Packet Data Length: 64
    [Response in: 16]
    [bInterfaceClass: Vendor Specific (0xff)]
Leftover Capture Data: 08020010190000000000000000000000000000000000000000000000000000000000000000000000000000000000000000000000000000000000000000000000

No.     Time           Source                Destination           Protocol Length Info
     16 15.579883      1.29.4                host                  USB      27     URB_BULK out

Frame 16: 27 bytes on wire (216 bits), 27 bytes captured (216 bits) on interface \\.\USBPcap1, id 0
    Section number: 1
    Interface id: 0 (\\.\USBPcap1)
        Interface name: \\.\USBPcap1
        Interface description: USBPcap1
    Encapsulation type: USB packets with USBPcap header (152)
    Arrival Time: Sep 24, 2025 13:34:10.138481000 CEST
    UTC Arrival Time: Sep 24, 2025 11:34:10.138481000 UTC
    Epoch Arrival Time: 1758713650.138481000
    [Time shift for this packet: 0.000000000 seconds]
    [Time delta from previous captured frame: 0.000037000 seconds]
    [Time delta from previous displayed frame: 0.000037000 seconds]
    [Time since reference or first frame: 15.579883000 seconds]
    Frame Number: 16
    Frame Length: 27 bytes (216 bits)
    Capture Length: 27 bytes (216 bits)
    [Frame is marked: False]
    [Frame is ignored: False]
    [Protocols in frame: usb]
USB URB
    [Source: 1.29.4]
    [Destination: host]
    USBPcap pseudoheader length: 27
    IRP ID: 0xffffa082c9cd5980
    IRP USBD_STATUS: USBD_STATUS_SUCCESS (0x00000000)
    URB Function: URB_FUNCTION_BULK_OR_INTERRUPT_TRANSFER (0x0009)
    IRP information: 0x01, Direction: PDO -> FDO
        0000 000. = Reserved: 0x00
        .... ...1 = Direction: PDO -> FDO (0x1)
    URB bus id: 1
    Device address: 29
    Endpoint: 0x04, Direction: OUT
        0... .... = Direction: OUT (0)
        .... 0100 = Endpoint number: 4
    URB transfer type: URB_BULK (0x03)
    Packet Data Length: 0
    [Request in: 15]
    [Time from request: 0.000037000 seconds]
    [bInterfaceClass: Vendor Specific (0xff)]

No.     Time           Source                Destination           Protocol Length Info
     17 15.579929      host                  1.29.3                USB      27     URB_BULK in

Frame 17: 27 bytes on wire (216 bits), 27 bytes captured (216 bits) on interface \\.\USBPcap1, id 0
    Section number: 1
    Interface id: 0 (\\.\USBPcap1)
        Interface name: \\.\USBPcap1
        Interface description: USBPcap1
    Encapsulation type: USB packets with USBPcap header (152)
    Arrival Time: Sep 24, 2025 13:34:10.138527000 CEST
    UTC Arrival Time: Sep 24, 2025 11:34:10.138527000 UTC
    Epoch Arrival Time: 1758713650.138527000
    [Time shift for this packet: 0.000000000 seconds]
    [Time delta from previous captured frame: 0.000046000 seconds]
    [Time delta from previous displayed frame: 0.000046000 seconds]
    [Time since reference or first frame: 15.579929000 seconds]
    Frame Number: 17
    Frame Length: 27 bytes (216 bits)
    Capture Length: 27 bytes (216 bits)
    [Frame is marked: False]
    [Frame is ignored: False]
    [Protocols in frame: usb]
USB URB
    [Source: host]
    [Destination: 1.29.3]
    USBPcap pseudoheader length: 27
    IRP ID: 0xffffa082cecdf980
    IRP USBD_STATUS: USBD_STATUS_SUCCESS (0x00000000)
    URB Function: URB_FUNCTION_BULK_OR_INTERRUPT_TRANSFER (0x0009)
    IRP information: 0x00, Direction: FDO -> PDO
        0000 000. = Reserved: 0x00
        .... ...0 = Direction: FDO -> PDO (0x0)
    URB bus id: 1
    Device address: 29
    Endpoint: 0x83, Direction: IN
        1... .... = Direction: IN (1)
        .... 0011 = Endpoint number: 3
    URB transfer type: URB_BULK (0x03)
    Packet Data Length: 0
    [Response in: 18]
    [bInterfaceClass: Vendor Specific (0xff)]

No.     Time           Source                Destination           Protocol Length Info
     18 15.584785      1.29.3                host                  USB      91     URB_BULK in

Frame 18: 91 bytes on wire (728 bits), 91 bytes captured (728 bits) on interface \\.\USBPcap1, id 0
    Section number: 1
    Interface id: 0 (\\.\USBPcap1)
        Interface name: \\.\USBPcap1
        Interface description: USBPcap1
    Encapsulation type: USB packets with USBPcap header (152)
    Arrival Time: Sep 24, 2025 13:34:10.143383000 CEST
    UTC Arrival Time: Sep 24, 2025 11:34:10.143383000 UTC
    Epoch Arrival Time: 1758713650.143383000
    [Time shift for this packet: 0.000000000 seconds]
    [Time delta from previous captured frame: 0.004856000 seconds]
    [Time delta from previous displayed frame: 0.004856000 seconds]
    [Time since reference or first frame: 15.584785000 seconds]
    Frame Number: 18
    Frame Length: 91 bytes (728 bits)
    Capture Length: 91 bytes (728 bits)
    [Frame is marked: False]
    [Frame is ignored: False]
    [Protocols in frame: usb]
USB URB
    [Source: 1.29.3]
    [Destination: host]
    USBPcap pseudoheader length: 27
    IRP ID: 0xffffa082cecdf980
    IRP USBD_STATUS: USBD_STATUS_SUCCESS (0x00000000)
    URB Function: URB_FUNCTION_BULK_OR_INTERRUPT_TRANSFER (0x0009)
    IRP information: 0x01, Direction: PDO -> FDO
        0000 000. = Reserved: 0x00
        .... ...1 = Direction: PDO -> FDO (0x1)
    URB bus id: 1
    Device address: 29
    Endpoint: 0x83, Direction: IN
        1... .... = Direction: IN (1)
        .... 0011 = Endpoint number: 3
    URB transfer type: URB_BULK (0x03)
    Packet Data Length: 64
    [Request in: 17]
    [Time from request: 0.004856000 seconds]
    [bInterfaceClass: Vendor Specific (0xff)]
Leftover Capture Data: 0902001019004000000000000000000000000000000000000018a2a40000000000000000000000000018a2a40000000000001f88000000000000000000000000

No.     Time           Source                Destination           Protocol Length Info
     19 15.584900      host                  1.29.4                USB      91     URB_BULK out

Frame 19: 91 bytes on wire (728 bits), 91 bytes captured (728 bits) on interface \\.\USBPcap1, id 0
    Section number: 1
    Interface id: 0 (\\.\USBPcap1)
        Interface name: \\.\USBPcap1
        Interface description: USBPcap1
    Encapsulation type: USB packets with USBPcap header (152)
    Arrival Time: Sep 24, 2025 13:34:10.143498000 CEST
    UTC Arrival Time: Sep 24, 2025 11:34:10.143498000 UTC
    Epoch Arrival Time: 1758713650.143498000
    [Time shift for this packet: 0.000000000 seconds]
    [Time delta from previous captured frame: 0.000115000 seconds]
    [Time delta from previous displayed frame: 0.000115000 seconds]
    [Time since reference or first frame: 15.584900000 seconds]
    Frame Number: 19
    Frame Length: 91 bytes (728 bits)
    Capture Length: 91 bytes (728 bits)
    [Frame is marked: False]
    [Frame is ignored: False]
    [Protocols in frame: usb]
USB URB
    [Source: host]
    [Destination: 1.29.4]
    USBPcap pseudoheader length: 27
    IRP ID: 0xffffa082b752e980
    IRP USBD_STATUS: USBD_STATUS_SUCCESS (0x00000000)
    URB Function: URB_FUNCTION_BULK_OR_INTERRUPT_TRANSFER (0x0009)
    IRP information: 0x00, Direction: FDO -> PDO
        0000 000. = Reserved: 0x00
        .... ...0 = Direction: FDO -> PDO (0x0)
    URB bus id: 1
    Device address: 29
    Endpoint: 0x04, Direction: OUT
        0... .... = Direction: OUT (0)
        .... 0100 = Endpoint number: 4
    URB transfer type: URB_BULK (0x03)
    Packet Data Length: 64
    [Response in: 20]
    [bInterfaceClass: Vendor Specific (0xff)]
Leftover Capture Data: 08030010680000000000000000000000000000000000000000000000000000000000000000000000000000000000000000000000000000000000000000000000

No.     Time           Source                Destination           Protocol Length Info
     20 15.584945      1.29.4                host                  USB      27     URB_BULK out

Frame 20: 27 bytes on wire (216 bits), 27 bytes captured (216 bits) on interface \\.\USBPcap1, id 0
    Section number: 1
    Interface id: 0 (\\.\USBPcap1)
        Interface name: \\.\USBPcap1
        Interface description: USBPcap1
    Encapsulation type: USB packets with USBPcap header (152)
    Arrival Time: Sep 24, 2025 13:34:10.143543000 CEST
    UTC Arrival Time: Sep 24, 2025 11:34:10.143543000 UTC
    Epoch Arrival Time: 1758713650.143543000
    [Time shift for this packet: 0.000000000 seconds]
    [Time delta from previous captured frame: 0.000045000 seconds]
    [Time delta from previous displayed frame: 0.000045000 seconds]
    [Time since reference or first frame: 15.584945000 seconds]
    Frame Number: 20
    Frame Length: 27 bytes (216 bits)
    Capture Length: 27 bytes (216 bits)
    [Frame is marked: False]
    [Frame is ignored: False]
    [Protocols in frame: usb]
USB URB
    [Source: 1.29.4]
    [Destination: host]
    USBPcap pseudoheader length: 27
    IRP ID: 0xffffa082b752e980
    IRP USBD_STATUS: USBD_STATUS_SUCCESS (0x00000000)
    URB Function: URB_FUNCTION_BULK_OR_INTERRUPT_TRANSFER (0x0009)
    IRP information: 0x01, Direction: PDO -> FDO
        0000 000. = Reserved: 0x00
        .... ...1 = Direction: PDO -> FDO (0x1)
    URB bus id: 1
    Device address: 29
    Endpoint: 0x04, Direction: OUT
        0... .... = Direction: OUT (0)
        .... 0100 = Endpoint number: 4
    URB transfer type: URB_BULK (0x03)
    Packet Data Length: 0
    [Request in: 19]
    [Time from request: 0.000045000 seconds]
    [bInterfaceClass: Vendor Specific (0xff)]

No.     Time           Source                Destination           Protocol Length Info
     21 15.584993      host                  1.29.3                USB      27     URB_BULK in

Frame 21: 27 bytes on wire (216 bits), 27 bytes captured (216 bits) on interface \\.\USBPcap1, id 0
    Section number: 1
    Interface id: 0 (\\.\USBPcap1)
        Interface name: \\.\USBPcap1
        Interface description: USBPcap1
    Encapsulation type: USB packets with USBPcap header (152)
    Arrival Time: Sep 24, 2025 13:34:10.143591000 CEST
    UTC Arrival Time: Sep 24, 2025 11:34:10.143591000 UTC
    Epoch Arrival Time: 1758713650.143591000
    [Time shift for this packet: 0.000000000 seconds]
    [Time delta from previous captured frame: 0.000048000 seconds]
    [Time delta from previous displayed frame: 0.000048000 seconds]
    [Time since reference or first frame: 15.584993000 seconds]
    Frame Number: 21
    Frame Length: 27 bytes (216 bits)
    Capture Length: 27 bytes (216 bits)
    [Frame is marked: False]
    [Frame is ignored: False]
    [Protocols in frame: usb]
USB URB
    [Source: host]
    [Destination: 1.29.3]
    USBPcap pseudoheader length: 27
    IRP ID: 0xffffa082c91e5980
    IRP USBD_STATUS: USBD_STATUS_SUCCESS (0x00000000)
    URB Function: URB_FUNCTION_BULK_OR_INTERRUPT_TRANSFER (0x0009)
    IRP information: 0x00, Direction: FDO -> PDO
        0000 000. = Reserved: 0x00
        .... ...0 = Direction: FDO -> PDO (0x0)
    URB bus id: 1
    Device address: 29
    Endpoint: 0x83, Direction: IN
        1... .... = Direction: IN (1)
        .... 0011 = Endpoint number: 3
    URB transfer type: URB_BULK (0x03)
    Packet Data Length: 0
    [Response in: 22]
    [bInterfaceClass: Vendor Specific (0xff)]

No.     Time           Source                Destination           Protocol Length Info
     22 15.585125      1.29.3                host                  USB      91     URB_BULK in

Frame 22: 91 bytes on wire (728 bits), 91 bytes captured (728 bits) on interface \\.\USBPcap1, id 0
    Section number: 1
    Interface id: 0 (\\.\USBPcap1)
        Interface name: \\.\USBPcap1
        Interface description: USBPcap1
    Encapsulation type: USB packets with USBPcap header (152)
    Arrival Time: Sep 24, 2025 13:34:10.143723000 CEST
    UTC Arrival Time: Sep 24, 2025 11:34:10.143723000 UTC
    Epoch Arrival Time: 1758713650.143723000
    [Time shift for this packet: 0.000000000 seconds]
    [Time delta from previous captured frame: 0.000132000 seconds]
    [Time delta from previous displayed frame: 0.000132000 seconds]
    [Time since reference or first frame: 15.585125000 seconds]
    Frame Number: 22
    Frame Length: 91 bytes (728 bits)
    Capture Length: 91 bytes (728 bits)
    [Frame is marked: False]
    [Frame is ignored: False]
    [Protocols in frame: usb]
USB URB
    [Source: 1.29.3]
    [Destination: host]
    USBPcap pseudoheader length: 27
    IRP ID: 0xffffa082c91e5980
    IRP USBD_STATUS: USBD_STATUS_SUCCESS (0x00000000)
    URB Function: URB_FUNCTION_BULK_OR_INTERRUPT_TRANSFER (0x0009)
    IRP information: 0x01, Direction: PDO -> FDO
        0000 000. = Reserved: 0x00
        .... ...1 = Direction: PDO -> FDO (0x1)
    URB bus id: 1
    Device address: 29
    Endpoint: 0x83, Direction: IN
        1... .... = Direction: IN (1)
        .... 0011 = Endpoint number: 3
    URB transfer type: URB_BULK (0x03)
    Packet Data Length: 64
    [Request in: 21]
    [Time from request: 0.000132000 seconds]
    [bInterfaceClass: Vendor Specific (0xff)]
Leftover Capture Data: 0903001068004010000041110000011000000000000000000018a2a40000000000000000000000000018a2a40000000000001f88000000000000000000000000

No.     Time           Source                Destination           Protocol Length Info
     23 15.585175      host                  1.29.4                USB      91     URB_BULK out

Frame 23: 91 bytes on wire (728 bits), 91 bytes captured (728 bits) on interface \\.\USBPcap1, id 0
    Section number: 1
    Interface id: 0 (\\.\USBPcap1)
        Interface name: \\.\USBPcap1
        Interface description: USBPcap1
    Encapsulation type: USB packets with USBPcap header (152)
    Arrival Time: Sep 24, 2025 13:34:10.143773000 CEST
    UTC Arrival Time: Sep 24, 2025 11:34:10.143773000 UTC
    Epoch Arrival Time: 1758713650.143773000
    [Time shift for this packet: 0.000000000 seconds]
    [Time delta from previous captured frame: 0.000050000 seconds]
    [Time delta from previous displayed frame: 0.000050000 seconds]
    [Time since reference or first frame: 15.585175000 seconds]
    Frame Number: 23
    Frame Length: 91 bytes (728 bits)
    Capture Length: 91 bytes (728 bits)
    [Frame is marked: False]
    [Frame is ignored: False]
    [Protocols in frame: usb]
USB URB
    [Source: host]
    [Destination: 1.29.4]
    USBPcap pseudoheader length: 27
    IRP ID: 0xffffa082cf5ce4b0
    IRP USBD_STATUS: USBD_STATUS_SUCCESS (0x00000000)
    URB Function: URB_FUNCTION_BULK_OR_INTERRUPT_TRANSFER (0x0009)
    IRP information: 0x00, Direction: FDO -> PDO
        0000 000. = Reserved: 0x00
        .... ...0 = Direction: FDO -> PDO (0x0)
    URB bus id: 1
    Device address: 29
    Endpoint: 0x04, Direction: OUT
        0... .... = Direction: OUT (0)
        .... 0100 = Endpoint number: 4
    URB transfer type: URB_BULK (0x03)
    Packet Data Length: 64
    [Response in: 24]
    [bInterfaceClass: Vendor Specific (0xff)]
Leftover Capture Data: 08040010180000000000400000000000000000000000000000000000000000000000000000000000000000000000000000000000000000000000000000000000

No.     Time           Source                Destination           Protocol Length Info
     24 15.585241      1.29.4                host                  USB      27     URB_BULK out

Frame 24: 27 bytes on wire (216 bits), 27 bytes captured (216 bits) on interface \\.\USBPcap1, id 0
    Section number: 1
    Interface id: 0 (\\.\USBPcap1)
        Interface name: \\.\USBPcap1
        Interface description: USBPcap1
    Encapsulation type: USB packets with USBPcap header (152)
    Arrival Time: Sep 24, 2025 13:34:10.143839000 CEST
    UTC Arrival Time: Sep 24, 2025 11:34:10.143839000 UTC
    Epoch Arrival Time: 1758713650.143839000
    [Time shift for this packet: 0.000000000 seconds]
    [Time delta from previous captured frame: 0.000066000 seconds]
    [Time delta from previous displayed frame: 0.000066000 seconds]
    [Time since reference or first frame: 15.585241000 seconds]
    Frame Number: 24
    Frame Length: 27 bytes (216 bits)
    Capture Length: 27 bytes (216 bits)
    [Frame is marked: False]
    [Frame is ignored: False]
    [Protocols in frame: usb]
USB URB
    [Source: 1.29.4]
    [Destination: host]
    USBPcap pseudoheader length: 27
    IRP ID: 0xffffa082cf5ce4b0
    IRP USBD_STATUS: USBD_STATUS_SUCCESS (0x00000000)
    URB Function: URB_FUNCTION_BULK_OR_INTERRUPT_TRANSFER (0x0009)
    IRP information: 0x01, Direction: PDO -> FDO
        0000 000. = Reserved: 0x00
        .... ...1 = Direction: PDO -> FDO (0x1)
    URB bus id: 1
    Device address: 29
    Endpoint: 0x04, Direction: OUT
        0... .... = Direction: OUT (0)
        .... 0100 = Endpoint number: 4
    URB transfer type: URB_BULK (0x03)
    Packet Data Length: 0
    [Request in: 23]
    [Time from request: 0.000066000 seconds]
    [bInterfaceClass: Vendor Specific (0xff)]

No.     Time           Source                Destination           Protocol Length Info
     25 15.585288      host                  1.29.3                USB      27     URB_BULK in

Frame 25: 27 bytes on wire (216 bits), 27 bytes captured (216 bits) on interface \\.\USBPcap1, id 0
    Section number: 1
    Interface id: 0 (\\.\USBPcap1)
        Interface name: \\.\USBPcap1
        Interface description: USBPcap1
    Encapsulation type: USB packets with USBPcap header (152)
    Arrival Time: Sep 24, 2025 13:34:10.143886000 CEST
    UTC Arrival Time: Sep 24, 2025 11:34:10.143886000 UTC
    Epoch Arrival Time: 1758713650.143886000
    [Time shift for this packet: 0.000000000 seconds]
    [Time delta from previous captured frame: 0.000047000 seconds]
    [Time delta from previous displayed frame: 0.000047000 seconds]
    [Time since reference or first frame: 15.585288000 seconds]
    Frame Number: 25
    Frame Length: 27 bytes (216 bits)
    Capture Length: 27 bytes (216 bits)
    [Frame is marked: False]
    [Frame is ignored: False]
    [Protocols in frame: usb]
USB URB
    [Source: host]
    [Destination: 1.29.3]
    USBPcap pseudoheader length: 27
    IRP ID: 0xffffa082c54e4010
    IRP USBD_STATUS: USBD_STATUS_SUCCESS (0x00000000)
    URB Function: URB_FUNCTION_BULK_OR_INTERRUPT_TRANSFER (0x0009)
    IRP information: 0x00, Direction: FDO -> PDO
        0000 000. = Reserved: 0x00
        .... ...0 = Direction: FDO -> PDO (0x0)
    URB bus id: 1
    Device address: 29
    Endpoint: 0x83, Direction: IN
        1... .... = Direction: IN (1)
        .... 0011 = Endpoint number: 3
    URB transfer type: URB_BULK (0x03)
    Packet Data Length: 0
    [Response in: 26]
    [bInterfaceClass: Vendor Specific (0xff)]

No.     Time           Source                Destination           Protocol Length Info
     26 15.585686      1.29.3                host                  USB      91     URB_BULK in

Frame 26: 91 bytes on wire (728 bits), 91 bytes captured (728 bits) on interface \\.\USBPcap1, id 0
    Section number: 1
    Interface id: 0 (\\.\USBPcap1)
        Interface name: \\.\USBPcap1
        Interface description: USBPcap1
    Encapsulation type: USB packets with USBPcap header (152)
    Arrival Time: Sep 24, 2025 13:34:10.144284000 CEST
    UTC Arrival Time: Sep 24, 2025 11:34:10.144284000 UTC
    Epoch Arrival Time: 1758713650.144284000
    [Time shift for this packet: 0.000000000 seconds]
    [Time delta from previous captured frame: 0.000398000 seconds]
    [Time delta from previous displayed frame: 0.000398000 seconds]
    [Time since reference or first frame: 15.585686000 seconds]
    Frame Number: 26
    Frame Length: 91 bytes (728 bits)
    Capture Length: 91 bytes (728 bits)
    [Frame is marked: False]
    [Frame is ignored: False]
    [Protocols in frame: usb]
USB URB
    [Source: 1.29.3]
    [Destination: host]
    USBPcap pseudoheader length: 27
    IRP ID: 0xffffa082c54e4010
    IRP USBD_STATUS: USBD_STATUS_SUCCESS (0x00000000)
    URB Function: URB_FUNCTION_BULK_OR_INTERRUPT_TRANSFER (0x0009)
    IRP information: 0x01, Direction: PDO -> FDO
        0000 000. = Reserved: 0x00
        .... ...1 = Direction: PDO -> FDO (0x1)
    URB bus id: 1
    Device address: 29
    Endpoint: 0x83, Direction: IN
        1... .... = Direction: IN (1)
        .... 0011 = Endpoint number: 3
    URB transfer type: URB_BULK (0x03)
    Packet Data Length: 64
    [Request in: 25]
    [Time from request: 0.000398000 seconds]
    [bInterfaceClass: Vendor Specific (0xff)]
Leftover Capture Data: 0b04000400000164000041110000011000000000000000000018a2a40000000000000000000000000018a2a40000000000001f88000000000000000000000000

No.     Time           Source                Destination           Protocol Length Info
     27 15.585734      host                  1.29.5                USB      27     URB_BULK in

Frame 27: 27 bytes on wire (216 bits), 27 bytes captured (216 bits) on interface \\.\USBPcap1, id 0
    Section number: 1
    Interface id: 0 (\\.\USBPcap1)
        Interface name: \\.\USBPcap1
        Interface description: USBPcap1
    Encapsulation type: USB packets with USBPcap header (152)
    Arrival Time: Sep 24, 2025 13:34:10.144332000 CEST
    UTC Arrival Time: Sep 24, 2025 11:34:10.144332000 UTC
    Epoch Arrival Time: 1758713650.144332000
    [Time shift for this packet: 0.000000000 seconds]
    [Time delta from previous captured frame: 0.000048000 seconds]
    [Time delta from previous displayed frame: 0.000048000 seconds]
    [Time since reference or first frame: 15.585734000 seconds]
    Frame Number: 27
    Frame Length: 27 bytes (216 bits)
    Capture Length: 27 bytes (216 bits)
    [Frame is marked: False]
    [Frame is ignored: False]
    [Protocols in frame: usb]
USB URB
    [Source: host]
    [Destination: 1.29.5]
    USBPcap pseudoheader length: 27
    IRP ID: 0xffffa082c55cf010
    IRP USBD_STATUS: USBD_STATUS_SUCCESS (0x00000000)
    URB Function: URB_FUNCTION_BULK_OR_INTERRUPT_TRANSFER (0x0009)
    IRP information: 0x00, Direction: FDO -> PDO
        0000 000. = Reserved: 0x00
        .... ...0 = Direction: FDO -> PDO (0x0)
    URB bus id: 1
    Device address: 29
    Endpoint: 0x85, Direction: IN
        1... .... = Direction: IN (1)
        .... 0101 = Endpoint number: 5
    URB transfer type: URB_BULK (0x03)
    Packet Data Length: 0
    [Response in: 28]
    [bInterfaceClass: Vendor Specific (0xff)]

No.     Time           Source                Destination           Protocol Length Info
     28 15.585755      1.29.5                host                  USB      383    URB_BULK in

Frame 28: 383 bytes on wire (3064 bits), 383 bytes captured (3064 bits) on interface \\.\USBPcap1, id 0
    Section number: 1
    Interface id: 0 (\\.\USBPcap1)
        Interface name: \\.\USBPcap1
        Interface description: USBPcap1
    Encapsulation type: USB packets with USBPcap header (152)
    Arrival Time: Sep 24, 2025 13:34:10.144353000 CEST
    UTC Arrival Time: Sep 24, 2025 11:34:10.144353000 UTC
    Epoch Arrival Time: 1758713650.144353000
    [Time shift for this packet: 0.000000000 seconds]
    [Time delta from previous captured frame: 0.000021000 seconds]
    [Time delta from previous displayed frame: 0.000021000 seconds]
    [Time since reference or first frame: 15.585755000 seconds]
    Frame Number: 28
    Frame Length: 383 bytes (3064 bits)
    Capture Length: 383 bytes (3064 bits)
    [Frame is marked: False]
    [Frame is ignored: False]
    [Protocols in frame: usb]
USB URB
    [Source: 1.29.5]
    [Destination: host]
    USBPcap pseudoheader length: 27
    IRP ID: 0xffffa082c55cf010
    IRP USBD_STATUS: USBD_STATUS_SUCCESS (0x00000000)
    URB Function: URB_FUNCTION_BULK_OR_INTERRUPT_TRANSFER (0x0009)
    IRP information: 0x01, Direction: PDO -> FDO
        0000 000. = Reserved: 0x00
        .... ...1 = Direction: PDO -> FDO (0x1)
    URB bus id: 1
    Device address: 29
    Endpoint: 0x85, Direction: IN
        1... .... = Direction: IN (1)
        .... 0101 = Endpoint number: 5
    URB transfer type: URB_BULK (0x03)
    Packet Data Length: 356
    [Request in: 27]
    [Time from request: 0.000021000 seconds]
    [bInterfaceClass: Vendor Specific (0xff)]
Leftover Capture Data […]: 180044100000015c00110002a83d0021000000000031000000020041000000010101000000040111000002000121000000800131000000c8014100000004021100000019022100000000023100000000024100000000101100003e801021000055f01031ffffe89010

No.     Time           Source                Destination           Protocol Length Info
     29 15.585830      host                  1.29.4                USB      91     URB_BULK out

Frame 29: 91 bytes on wire (728 bits), 91 bytes captured (728 bits) on interface \\.\USBPcap1, id 0
    Section number: 1
    Interface id: 0 (\\.\USBPcap1)
        Interface name: \\.\USBPcap1
        Interface description: USBPcap1
    Encapsulation type: USB packets with USBPcap header (152)
    Arrival Time: Sep 24, 2025 13:34:10.144428000 CEST
    UTC Arrival Time: Sep 24, 2025 11:34:10.144428000 UTC
    Epoch Arrival Time: 1758713650.144428000
    [Time shift for this packet: 0.000000000 seconds]
    [Time delta from previous captured frame: 0.000075000 seconds]
    [Time delta from previous displayed frame: 0.000075000 seconds]
    [Time since reference or first frame: 15.585830000 seconds]
    Frame Number: 29
    Frame Length: 91 bytes (728 bits)
    Capture Length: 91 bytes (728 bits)
    [Frame is marked: False]
    [Frame is ignored: False]
    [Protocols in frame: usb]
USB URB
    [Source: host]
    [Destination: 1.29.4]
    USBPcap pseudoheader length: 27
    IRP ID: 0xffffa082c5fd4010
    IRP USBD_STATUS: USBD_STATUS_SUCCESS (0x00000000)
    URB Function: URB_FUNCTION_BULK_OR_INTERRUPT_TRANSFER (0x0009)
    IRP information: 0x00, Direction: FDO -> PDO
        0000 000. = Reserved: 0x00
        .... ...0 = Direction: FDO -> PDO (0x0)
    URB bus id: 1
    Device address: 29
    Endpoint: 0x04, Direction: OUT
        0... .... = Direction: OUT (0)
        .... 0100 = Endpoint number: 4
    URB transfer type: URB_BULK (0x03)
    Packet Data Length: 64
    [Response in: 30]
    [bInterfaceClass: Vendor Specific (0xff)]
Leftover Capture Data: 08050010180000000000200000000000000000000000000000000000000000000000000000000000000000000000000000000000000000000000000000000000

No.     Time           Source                Destination           Protocol Length Info
     30 15.585853      1.29.4                host                  USB      27     URB_BULK out

Frame 30: 27 bytes on wire (216 bits), 27 bytes captured (216 bits) on interface \\.\USBPcap1, id 0
    Section number: 1
    Interface id: 0 (\\.\USBPcap1)
        Interface name: \\.\USBPcap1
        Interface description: USBPcap1
    Encapsulation type: USB packets with USBPcap header (152)
    Arrival Time: Sep 24, 2025 13:34:10.144451000 CEST
    UTC Arrival Time: Sep 24, 2025 11:34:10.144451000 UTC
    Epoch Arrival Time: 1758713650.144451000
    [Time shift for this packet: 0.000000000 seconds]
    [Time delta from previous captured frame: 0.000023000 seconds]
    [Time delta from previous displayed frame: 0.000023000 seconds]
    [Time since reference or first frame: 15.585853000 seconds]
    Frame Number: 30
    Frame Length: 27 bytes (216 bits)
    Capture Length: 27 bytes (216 bits)
    [Frame is marked: False]
    [Frame is ignored: False]
    [Protocols in frame: usb]
USB URB
    [Source: 1.29.4]
    [Destination: host]
    USBPcap pseudoheader length: 27
    IRP ID: 0xffffa082c5fd4010
    IRP USBD_STATUS: USBD_STATUS_SUCCESS (0x00000000)
    URB Function: URB_FUNCTION_BULK_OR_INTERRUPT_TRANSFER (0x0009)
    IRP information: 0x01, Direction: PDO -> FDO
        0000 000. = Reserved: 0x00
        .... ...1 = Direction: PDO -> FDO (0x1)
    URB bus id: 1
    Device address: 29
    Endpoint: 0x04, Direction: OUT
        0... .... = Direction: OUT (0)
        .... 0100 = Endpoint number: 4
    URB transfer type: URB_BULK (0x03)
    Packet Data Length: 0
    [Request in: 29]
    [Time from request: 0.000023000 seconds]
    [bInterfaceClass: Vendor Specific (0xff)]

No.     Time           Source                Destination           Protocol Length Info
     31 15.585899      host                  1.29.3                USB      27     URB_BULK in

Frame 31: 27 bytes on wire (216 bits), 27 bytes captured (216 bits) on interface \\.\USBPcap1, id 0
    Section number: 1
    Interface id: 0 (\\.\USBPcap1)
        Interface name: \\.\USBPcap1
        Interface description: USBPcap1
    Encapsulation type: USB packets with USBPcap header (152)
    Arrival Time: Sep 24, 2025 13:34:10.144497000 CEST
    UTC Arrival Time: Sep 24, 2025 11:34:10.144497000 UTC
    Epoch Arrival Time: 1758713650.144497000
    [Time shift for this packet: 0.000000000 seconds]
    [Time delta from previous captured frame: 0.000046000 seconds]
    [Time delta from previous displayed frame: 0.000046000 seconds]
    [Time since reference or first frame: 15.585899000 seconds]
    Frame Number: 31
    Frame Length: 27 bytes (216 bits)
    Capture Length: 27 bytes (216 bits)
    [Frame is marked: False]
    [Frame is ignored: False]
    [Protocols in frame: usb]
USB URB
    [Source: host]
    [Destination: 1.29.3]
    USBPcap pseudoheader length: 27
    IRP ID: 0xffffa082c55ce010
    IRP USBD_STATUS: USBD_STATUS_SUCCESS (0x00000000)
    URB Function: URB_FUNCTION_BULK_OR_INTERRUPT_TRANSFER (0x0009)
    IRP information: 0x00, Direction: FDO -> PDO
        0000 000. = Reserved: 0x00
        .... ...0 = Direction: FDO -> PDO (0x0)
    URB bus id: 1
    Device address: 29
    Endpoint: 0x83, Direction: IN
        1... .... = Direction: IN (1)
        .... 0011 = Endpoint number: 3
    URB transfer type: URB_BULK (0x03)
    Packet Data Length: 0
    [Response in: 32]
    [bInterfaceClass: Vendor Specific (0xff)]

No.     Time           Source                Destination           Protocol Length Info
     32 15.586244      1.29.3                host                  USB      91     URB_BULK in

Frame 32: 91 bytes on wire (728 bits), 91 bytes captured (728 bits) on interface \\.\USBPcap1, id 0
    Section number: 1
    Interface id: 0 (\\.\USBPcap1)
        Interface name: \\.\USBPcap1
        Interface description: USBPcap1
    Encapsulation type: USB packets with USBPcap header (152)
    Arrival Time: Sep 24, 2025 13:34:10.144842000 CEST
    UTC Arrival Time: Sep 24, 2025 11:34:10.144842000 UTC
    Epoch Arrival Time: 1758713650.144842000
    [Time shift for this packet: 0.000000000 seconds]
    [Time delta from previous captured frame: 0.000345000 seconds]
    [Time delta from previous displayed frame: 0.000345000 seconds]
    [Time since reference or first frame: 15.586244000 seconds]
    Frame Number: 32
    Frame Length: 91 bytes (728 bits)
    Capture Length: 91 bytes (728 bits)
    [Frame is marked: False]
    [Frame is ignored: False]
    [Protocols in frame: usb]
USB URB
    [Source: 1.29.3]
    [Destination: host]
    USBPcap pseudoheader length: 27
    IRP ID: 0xffffa082c55ce010
    IRP USBD_STATUS: USBD_STATUS_SUCCESS (0x00000000)
    URB Function: URB_FUNCTION_BULK_OR_INTERRUPT_TRANSFER (0x0009)
    IRP information: 0x01, Direction: PDO -> FDO
        0000 000. = Reserved: 0x00
        .... ...1 = Direction: PDO -> FDO (0x1)
    URB bus id: 1
    Device address: 29
    Endpoint: 0x83, Direction: IN
        1... .... = Direction: IN (1)
        .... 0011 = Endpoint number: 3
    URB transfer type: URB_BULK (0x03)
    Packet Data Length: 64
    [Request in: 31]
    [Time from request: 0.000345000 seconds]
    [bInterfaceClass: Vendor Specific (0xff)]
Leftover Capture Data: 0b05000400000121000041110000011000000000000000000018a2a40000000000000000000000000018a2a40000000000001f88000000000000000000000000

No.     Time           Source                Destination           Protocol Length Info
     33 15.586308      host                  1.29.5                USB      27     URB_BULK in

Frame 33: 27 bytes on wire (216 bits), 27 bytes captured (216 bits) on interface \\.\USBPcap1, id 0
    Section number: 1
    Interface id: 0 (\\.\USBPcap1)
        Interface name: \\.\USBPcap1
        Interface description: USBPcap1
    Encapsulation type: USB packets with USBPcap header (152)
    Arrival Time: Sep 24, 2025 13:34:10.144906000 CEST
    UTC Arrival Time: Sep 24, 2025 11:34:10.144906000 UTC
    Epoch Arrival Time: 1758713650.144906000
    [Time shift for this packet: 0.000000000 seconds]
    [Time delta from previous captured frame: 0.000064000 seconds]
    [Time delta from previous displayed frame: 0.000064000 seconds]
    [Time since reference or first frame: 15.586308000 seconds]
    Frame Number: 33
    Frame Length: 27 bytes (216 bits)
    Capture Length: 27 bytes (216 bits)
    [Frame is marked: False]
    [Frame is ignored: False]
    [Protocols in frame: usb]
USB URB
    [Source: host]
    [Destination: 1.29.5]
    USBPcap pseudoheader length: 27
    IRP ID: 0xffffa082a7ed7010
    IRP USBD_STATUS: USBD_STATUS_SUCCESS (0x00000000)
    URB Function: URB_FUNCTION_BULK_OR_INTERRUPT_TRANSFER (0x0009)
    IRP information: 0x00, Direction: FDO -> PDO
        0000 000. = Reserved: 0x00
        .... ...0 = Direction: FDO -> PDO (0x0)
    URB bus id: 1
    Device address: 29
    Endpoint: 0x85, Direction: IN
        1... .... = Direction: IN (1)
        .... 0101 = Endpoint number: 5
    URB transfer type: URB_BULK (0x03)
    Packet Data Length: 0
    [Response in: 34]
    [bInterfaceClass: Vendor Specific (0xff)]

No.     Time           Source                Destination           Protocol Length Info
     34 15.586332      1.29.5                host                  USB      316    URB_BULK in

Frame 34: 316 bytes on wire (2528 bits), 316 bytes captured (2528 bits) on interface \\.\USBPcap1, id 0
    Section number: 1
    Interface id: 0 (\\.\USBPcap1)
        Interface name: \\.\USBPcap1
        Interface description: USBPcap1
    Encapsulation type: USB packets with USBPcap header (152)
    Arrival Time: Sep 24, 2025 13:34:10.144930000 CEST
    UTC Arrival Time: Sep 24, 2025 11:34:10.144930000 UTC
    Epoch Arrival Time: 1758713650.144930000
    [Time shift for this packet: 0.000000000 seconds]
    [Time delta from previous captured frame: 0.000024000 seconds]
    [Time delta from previous displayed frame: 0.000024000 seconds]
    [Time since reference or first frame: 15.586332000 seconds]
    Frame Number: 34
    Frame Length: 316 bytes (2528 bits)
    Capture Length: 316 bytes (2528 bits)
    [Frame is marked: False]
    [Frame is ignored: False]
    [Protocols in frame: usb]
USB URB
    [Source: 1.29.5]
    [Destination: host]
    USBPcap pseudoheader length: 27
    IRP ID: 0xffffa082a7ed7010
    IRP USBD_STATUS: USBD_STATUS_SUCCESS (0x00000000)
    URB Function: URB_FUNCTION_BULK_OR_INTERRUPT_TRANSFER (0x0009)
    IRP information: 0x01, Direction: PDO -> FDO
        0000 000. = Reserved: 0x00
        .... ...1 = Direction: PDO -> FDO (0x1)
    URB bus id: 1
    Device address: 29
    Endpoint: 0x85, Direction: IN
        1... .... = Direction: IN (1)
        .... 0101 = Endpoint number: 5
    URB transfer type: URB_BULK (0x03)
    Packet Data Length: 289
    [Request in: 33]
    [Time from request: 0.000024000 seconds]
    [bInterfaceClass: Vendor Specific (0xff)]
Leftover Capture Data […]: 18004410000001190031000000020041000000010101000000040111000002000121000000800131000000c8014100000004021100000019022100000000023100000000024100000000102e000b4d5932343436435531340010390b0b0300104100000004104909ff

No.     Time           Source                Destination           Protocol Length Info
     35 15.586410      host                  1.29.4                USB      91     URB_BULK out

Frame 35: 91 bytes on wire (728 bits), 91 bytes captured (728 bits) on interface \\.\USBPcap1, id 0
    Section number: 1
    Interface id: 0 (\\.\USBPcap1)
        Interface name: \\.\USBPcap1
        Interface description: USBPcap1
    Encapsulation type: USB packets with USBPcap header (152)
    Arrival Time: Sep 24, 2025 13:34:10.145008000 CEST
    UTC Arrival Time: Sep 24, 2025 11:34:10.145008000 UTC
    Epoch Arrival Time: 1758713650.145008000
    [Time shift for this packet: 0.000000000 seconds]
    [Time delta from previous captured frame: 0.000078000 seconds]
    [Time delta from previous displayed frame: 0.000078000 seconds]
    [Time since reference or first frame: 15.586410000 seconds]
    Frame Number: 35
    Frame Length: 91 bytes (728 bits)
    Capture Length: 91 bytes (728 bits)
    [Frame is marked: False]
    [Frame is ignored: False]
    [Protocols in frame: usb]
USB URB
    [Source: host]
    [Destination: 1.29.4]
    USBPcap pseudoheader length: 27
    IRP ID: 0xffffa082c5fd5010
    IRP USBD_STATUS: USBD_STATUS_SUCCESS (0x00000000)
    URB Function: URB_FUNCTION_BULK_OR_INTERRUPT_TRANSFER (0x0009)
    IRP information: 0x00, Direction: FDO -> PDO
        0000 000. = Reserved: 0x00
        .... ...0 = Direction: FDO -> PDO (0x0)
    URB bus id: 1
    Device address: 29
    Endpoint: 0x04, Direction: OUT
        0... .... = Direction: OUT (0)
        .... 0100 = Endpoint number: 4
    URB transfer type: URB_BULK (0x03)
    Packet Data Length: 64
    [Response in: 36]
    [bInterfaceClass: Vendor Specific (0xff)]
Leftover Capture Data: 0806001cb4000000000c000000010000000000000031000000010041000000010000000000000000000000000000000000000000000000000000000000000000
